{
  "version": "1.0",
  "metadata": {
    "title": "Training Progress Report - Block 5 Week 1",
    "period": {
      "startDate": "2025-11-04",
      "endDate": "2025-11-07",
      "blockRange": "5-5",
      "weeks": 1.0
    },
    "generatedDate": "2025-11-10"
  },
  "summary": {
    "grade": "A-",
    "kpis": [
      {
        "label": "Total Sessions",
        "value": "3",
        "sentiment": "positive"
      },
      {
        "label": "Training Week",
        "value": "1 of 4",
        "sentiment": "neutral"
      },
      {
        "label": "Adherence Rate",
        "value": "100%",
        "sentiment": "positive"
      },
      {
        "label": "Avg RPE",
        "value": "7.3",
        "sentiment": "positive"
      },
      {
        "label": "Training Density",
        "value": "Supersets",
        "sentiment": "positive"
      },
      {
        "label": "Injury Status",
        "value": "Injury-Free",
        "sentiment": "positive"
      }
    ],
    "highlights": [
      "üéØ New hypertrophy mesocycle launched with superset-dense programming (10-15 rep range)",
      "üí™ Strong chest pressing: Flat DB bench 40√ó2 √ó 10 @ RPE 7-8, maintained across 3 superset rounds",
      "ü¶µ Solid lower body foundation: Goblet squat 60 lb √ó 10, DB RDL 60√ó2 √ó 10, RPE 7-8",
      "üí™ Back work volume: One-arm row 50 lb √ó 10 per arm across 3 rounds, chest-supported row 40√ó2 √ó 10",
      "‚úÖ Excellent RPE discipline: No sessions exceeded RPE 8 on average (7.0-7.7), leaving room for progression",
      "‚ö° High training density: All sessions used supersets for time efficiency and metabolic stress"
    ],
    "injuryStatus": "Injury-free. No pain or discomfort reported. All exercises completed as prescribed with good form and RPE control."
  },
  "sections": [
    {
      "type": "strength-analysis",
      "title": "üí™ Strength Progression by Movement Pattern",
      "subsections": [
        {
          "subtitle": "Horizontal Press (Chest)",
          "table": {
            "type": "exercise-progression",
            "columns": ["Exercise", "First Session", "Peak Performance", "Volume Change", "Sessions"],
            "rows": [
              {
                "exercise": "Flat Dumbbell Bench Press",
                "firstSession": "50√ó2 √ó 6 @ RPE 7-9 (Oct 21)",
                "peakPerformance": "40√ó2 √ó 10,10,6 @ RPE 7-8 (Nov 4)",
                "volumeChange": "Hypertrophy transition",
                "volumeChangeSentiment": "positive",
                "sessions": "1"
              },
              {
                "exercise": "Incline Dumbbell Bench Press",
                "firstSession": "40√ó2 √ó 8,6,4 @ RPE 7-9 (Oct 21)",
                "peakPerformance": "30√ó2 √ó 10,10 @ RPE 8 (Nov 4)",
                "volumeChange": "Volume increase",
                "volumeChangeSentiment": "positive",
                "sessions": "1"
              },
              {
                "exercise": "Close-Grip Dumbbell Press",
                "firstSession": "N/A - New exercise",
                "peakPerformance": "30√ó2 √ó 10,10,6 @ RPE 7-8 (Nov 4)",
                "volumeChange": "Baseline established",
                "volumeChangeSentiment": "positive",
                "sessions": "1"
              }
            ]
          },
          "observation": "Strong transition from strength phase (6-8 reps, RPE 7-9) to hypertrophy phase (10-15 reps, RPE 7-8). Flat bench maintained excellent volume with 40√ó2 across superset rounds. Close-grip press added for direct triceps hypertrophy stimulus. Incline bench shows controlled progression at lower load with higher reps."
        },
        {
          "subtitle": "Horizontal Pull (Back)",
          "table": {
            "type": "exercise-progression",
            "columns": ["Exercise", "First Session", "Peak Performance", "Volume Change", "Sessions"],
            "rows": [
              {
                "exercise": "One-Arm Dumbbell Row",
                "firstSession": "55 lb √ó 8 @ RPE 7-8 (Oct 21)",
                "peakPerformance": "50 lb √ó 10,10,10 @ RPE 7-8 (Nov 7)",
                "volumeChange": "Volume increase",
                "volumeChangeSentiment": "positive",
                "sessions": "1"
              },
              {
                "exercise": "Chest-Supported Dumbbell Row",
                "firstSession": "45√ó2 √ó 10 @ RPE 7-9 (Oct 21)",
                "peakPerformance": "40√ó2 √ó 10,10,10 @ RPE 7 (Nov 7)",
                "volumeChange": "Volume increase",
                "volumeChangeSentiment": "positive",
                "sessions": "1"
              }
            ]
          },
          "observation": "Solid back volume established in hypertrophy phase. One-arm row transitioned from 55 lb √ó 8 (strength) to 50 lb √ó 10 (hypertrophy) with consistent RPE 7-8. Chest-supported row increased to 3 rounds √ó 10 reps at controlled RPE 7. Both exercises show excellent fatigue management across superset rounds with minimal rep drop-off."
        },
        {
          "subtitle": "Squat Pattern & Hip Hinge",
          "table": {
            "type": "exercise-progression",
            "columns": ["Exercise", "First Session", "Peak Performance", "Volume Change", "Sessions"],
            "rows": [
              {
                "exercise": "Goblet Squat",
                "firstSession": "67.5 lb √ó 8 @ RPE 7-8 (Oct 23)",
                "peakPerformance": "60 lb √ó 10,10,8 @ RPE 7-7.5 (Nov 6)",
                "volumeChange": "Volume increase",
                "volumeChangeSentiment": "positive",
                "sessions": "1"
              },
              {
                "exercise": "Dumbbell RDL",
                "firstSession": "67.5√ó2 √ó 8 @ RPE 7-8 (Oct 23)",
                "peakPerformance": "60√ó2 √ó 10,10,8 @ RPE 8 (Nov 6)",
                "volumeChange": "Volume increase",
                "volumeChangeSentiment": "positive",
                "sessions": "1"
              },
              {
                "exercise": "Dumbbell Hip Thrust",
                "firstSession": "N/A - New exercise",
                "peakPerformance": "60 lb √ó 12,12,12 @ RPE 7 (Nov 6)",
                "volumeChange": "Baseline established",
                "volumeChangeSentiment": "positive",
                "sessions": "1"
              },
              {
                "exercise": "Bulgarian Split Squat",
                "firstSession": "47.5√ó2 √ó 8 @ RPE 7-9 (Oct 23)",
                "peakPerformance": "40√ó2 √ó 12,10,10 @ RPE 7-8 (Nov 6)",
                "volumeChange": "Volume increase",
                "volumeChangeSentiment": "positive",
                "sessions": "1"
              }
            ]
          },
          "observation": "Excellent lower body hypertrophy transition. Goblet squat and RDL both transitioned from 67.5 lb (strength phase) to 60 lb with +2 reps (hypertrophy phase) while maintaining RPE 7-8. Hip thrust introduced at 60 lb √ó 12 with excellent RPE control (7). Bulgarian split squats show smart load reduction (47.5√ó2 ‚Üí 40√ó2) to accommodate higher rep targets (12 reps). All movements maintained minimal fatigue across superset rounds."
        },
        {
          "subtitle": "Arm Development (Biceps & Triceps)",
          "table": {
            "type": "exercise-progression",
            "columns": ["Exercise", "First Session", "Peak Performance", "Volume Change", "Sessions"],
            "rows": [
              {
                "exercise": "Hammer Curl",
                "firstSession": "25√ó2 √ó 10-13 @ RPE 5-6 (Oct 31 deload)",
                "peakPerformance": "30√ó2 √ó 10,5,5 @ RPE 7-8 (Nov 7)",
                "volumeChange": "+20% load",
                "volumeChangeSentiment": "positive",
                "sessions": "1"
              },
              {
                "exercise": "Incline Dumbbell Curl",
                "firstSession": "N/A - New exercise",
                "peakPerformance": "20√ó2 √ó 5, 10√ó2 √ó 15,15 @ RPE 7 (Nov 7)",
                "volumeChange": "Baseline established",
                "volumeChangeSentiment": "neutral",
                "sessions": "1"
              },
              {
                "exercise": "Alternating Dumbbell Curl",
                "firstSession": "17.5 lb √ó 15,15 @ RPE 5 (Oct 31 deload)",
                "peakPerformance": "10-20 lb √ó 20,15 @ RPE 7 (Nov 7)",
                "volumeChange": "Volume increase",
                "volumeChangeSentiment": "positive",
                "sessions": "1"
              },
              {
                "exercise": "Overhead Triceps Extension",
                "firstSession": "25 lb √ó 15,15 @ RPE 6-7 (Oct 31 deload)",
                "peakPerformance": "30 lb √ó 10,10 @ RPE 7-8 (Nov 4)",
                "volumeChange": "+20% load",
                "volumeChangeSentiment": "positive",
                "sessions": "1"
              },
              {
                "exercise": "Diamond Push-ups",
                "firstSession": "10,8 @ RPE 6 (Oct 31 deload)",
                "peakPerformance": "10,8 @ RPE 7-8 (Nov 4)",
                "volumeChange": "Maintained",
                "volumeChangeSentiment": "neutral",
                "sessions": "1"
              }
            ]
          },
          "observation": "Strong arm development foundation established. Hammer curls progressed to 30√ó2 with notable fatigue cascade (10‚Üí5‚Üí5 reps) indicating appropriate synergist loading after rows. Overhead triceps extensions jumped to 30 lb with solid 10-rep sets. Incline curls introduced with load experimentation (20√ó2 √ó 5 too heavy, dropped to 10√ó2 √ó 15). Alternating curls and diamond push-ups maintained as finishers. Notable synergist fatigue in biceps after back work suggests supersets are creating appropriate metabolic stress."
        },
        {
          "subtitle": "Core & Accessory",
          "table": {
            "type": "exercise-progression",